{
  "schema_version": "mio.turn.v1",
  "kind": "delegate",
  "user_message": {
    "to": "user",
    "text": "I’ll ask Shiro."
  },
  "delegation": {
    "to": "shiro",
    "goal": "Investigate",
    "instruction": "Measure the delay.",
    "constraints": [
      {
        "key": "keep_model",
        "text": "Do not change the model.",
        "source_message_ids": [
          "msg_00000000-0000-7000-8000-000000000101",
          "msg_00000000-0000-7000-8000-000000000101",
          "msg_00000000-0000-7000-8000-000000000101",
          "msg_00000000-0000-7000-8000-000000000101",
          "msg_00000000-0000-7000-8000-000000000101",
          "msg_00000000-0000-7000-8000-000000000101",
          "msg_00000000-0000-7000-8000-000000000101",
          "msg_00000000-0000-7000-8000-000000000101",
          "msg_00000000-0000-7000-8000-000000000101",
          "msg_00000000-0000-7000-8000-000000000101",
          "msg_00000000-0000-7000-8000-000000000101",
          "msg_00000000-0000-7000-8000-000000000101",
          "msg_00000000-0000-7000-8000-000000000101",
          "msg_00000000-0000-7000-8000-000000000101",
          "msg_00000000-0000-7000-8000-000000000101",
          "msg_00000000-0000-7000-8000-000000000101"
        ]
      }
    ],
    "expected_output": "Evidence",
    "source_message_ids": [
      "msg_00000000-0000-7000-8000-000000000101",
      "msg_00000000-0000-7000-8000-000000000101",
      "msg_00000000-0000-7000-8000-000000000101",
      "msg_00000000-0000-7000-8000-000000000101",
      "msg_00000000-0000-7000-8000-000000000101",
      "msg_00000000-0000-7000-8000-000000000101",
      "msg_00000000-0000-7000-8000-000000000101",
      "msg_00000000-0000-7000-8000-000000000101",
      "msg_00000000-0000-7000-8000-000000000101",
      "msg_00000000-0000-7000-8000-000000000101",
      "msg_00000000-0000-7000-8000-000000000101",
      "msg_00000000-0000-7000-8000-000000000101",
      "msg_00000000-0000-7000-8000-000000000101",
      "msg_00000000-0000-7000-8000-000000000101",
      "msg_00000000-0000-7000-8000-000000000101",
      "msg_00000000-0000-7000-8000-000000000101",
      "msg_00000000-0000-7000-8000-000000000101"
    ]
  }
}
